sub_theme,count,attitudes_raw,att_pos,att_neg,att_neu,avg_conf,example,ids
Government Action,1,negative:1,0,1,0,0.8,Forcing Government To Scrap Rio Tinto Lithium Mining Project,132
Government Contracts,1,positive:1,1,0,0,0.9,US buys scandium oxide from Rio Tinto,170
Gratitude,1,positive:1,1,0,0,0.75,Desde j¡§¡é agradecido. :),134
Growth Potential,1,positive:1,1,0,0,0.85,Potential 20-30% zu machen,109
Harassment/Misconduct,1,negative:1,0,1,0,0.9,What If Sensei Suddenly Called a Student His Wife?,295
Hate Speech,1,negative:1,0,1,0,0.7,govora mr?nje ka LGBT osobama,39
Heritage Preservation,1,negative:1,0,1,0,0.95,destroyed by mining,20
Heritage Protection,1,negative:1,0,1,0,0.95,destroyed heritage site,136
Hiring Activity,1,positive:1,1,0,0,0.9,a Maintenance Scheduler at Rio Tinto! in Rio Tinto,153
Hiring/Recruiting,1,neutral:1,0,0,1,0.5,[HIRING] a Maintenance Scheduler at Rio Tinto! in Rio Tinto,155
Historical Performance,1,positive:1,1,0,0,0.85,sind die um diese Jahreszeit immer am Tiefpunkt gewesen und von Herbst zu Winter gestiegen.,2
Humanitarian Response,1,negative:1,0,1,0,0.9,appearing to ignore a mother and baby?¡¥s pleas for help,231
Incident Management,1,negative:1,0,1,0,0.75,Police officer removing a man,266
Indigenous Rights,1,negative:1,0,1,0,0.9,threatens Apache sacred land,164
Industry Collaboration,1,positive:1,1,0,0,0.65,breaks ranks to back,125
Information Disclosure,1,neutral:1,0,0,1,0.3,Came across Solomun?¡¥s 2024/2025 equipment rider for those curious.,281
Information Seeking/Clarification,1,neutral:1,0,0,1,0.8,"As a newbie investor, do you think this company is worth investing in.",6
Information/Media,1,negative:1,0,1,0,0.8,deo su agresivne kampanje dezinformacija,72
Infrastructure & Engineering,1,neutral:1,0,0,1,0.7,Rio Tinto je u svojoj studiji naveo da ce ceo rudnik biti podignut iznad nivoa poplavnog talasa iz 2014. godine tako sto ce podici ceo plato rudnika za 4m na POVRSINI OD 220 HEKTARA.,147
Infrastructure (City),1,neutral:1,0,0,1,0.85,Bullet Train in Rio de Janeiro,368
Innovation in Extraction,1,positive:1,1,0,0,0.95,"scientists became the first to develop a process which allows the extraction of high-purity scandium oxide from waste streams of titanium dioxide production, without the need for any additional mining",176
Intellectual Property,1,negative:1,0,1,0,0.9,Adele plagiarized a song performed by Martinho da Vila,302
International Appeal,1,positive:1,1,0,0,0.8,"Brazil has been breaking records in international tourism lately. According to recent data, Rio alone saw a 51% increase in foreign visitors compared to last year. The city?¡¥s international appeal seem",208
International Presence,1,neutral:1,0,0,1,0.6,u tre?im zemljama,41
Interview Process,1,neutral:1,0,0,1,0.8,Has anyone had an interview with their mechanical engineering team and can shed some light on the types of questions I can expect?,167
Inventory Management,1,neutral:1,0,0,1,0.95,Camera stockpile,370
Investment Decision,1,positive:1,1,0,0,0.95,I'm thinking about opening a position in Rio Tinto,1
Investment Opportunity,1,positive:1,1,0,0,0.8,Investing in Rio Tinto worth it?,6
Investment Performance,1,negative:1,0,1,0,0.9,$12 billion 2016 olympic park is mostly abandoned,280
Investment Potential,1,positive:1,1,0,0,0.85,idealer Einstiegszeitpunkt,109
Investment Strategy,1,neutral:1,0,0,1,0.5,Sollte man da reinbuttern?,122
Investment Strategy/Instrument,1,neutral:1,0,0,1,0.8,Or if they are part of an index fund of some sort?,6
Investment Timing,1,positive:1,1,0,0,0.85,Eigentlich sollte man jetzt in Rio Tinto rein.,2
Investment/Expansion,1,positive:1,1,0,0,0.9,given approval for $2.5b Pilbara iron ore expansion,51
Investment/Portfolio,1,positive:1,1,0,0,0.6,kupio zemlji?te za 1.2 miliona evra,160
Investment/Spending,1,positive:1,1,0,0,0.9,Nyambaatar spent 44 billion to build his park,65
Involvement/Engagement,1,positive:1,1,0,0,0.8,Rio Tinto will be heavily involved in this discovery.,6
Job Category,1,neutral:1,0,0,1,0.8,#senior#engineer#fulltime,180
Job Description,1,positive:1,1,0,0,0.85,"Le titulaire du poste sera responsable de la pr¡§|vention, de la pr¡§|paration et de l?¡¥intervention en mati¡§¡§re de s¡§|curit¡§| incendie, de premiers secours, de sauvetages techniques et de s?ret¡§| industrielle",150
Job Market Competition,1,negative:1,0,1,0,0.8,It?¡¥s a bit frustrating because this might mean more candidates are now competing for the same positions.,161
Job Posting Date,1,neutral:1,0,0,1,0.95,"Date Posted: September 21, 2025",187
Job Role,1,neutral:1,0,0,1,0.95,Electrical Engineer (High Voltage),187
Job Security,1,negative:1,0,1,0,0.85,potential redundancies or retrenchments,184
Job Type/Contract,1,neutral:1,0,0,1,0.7,Fixed Term,182
Land Rights,1,negative:1,0,1,0,0.85,does not own land it is about to give to,13
Language Support,1,negative:1,0,1,0,0.95,"I called, a recording said, ?¡ãFor English, press star.?¡À I pressed star. Someone answered in Portuguese. I asked if they spoke English or Spanish, no, they didn?¡¥t.",243
Learning & Development,1,neutral:1,0,0,1,0.7,Student Introduction,311
Legal & Governance,1,negative:1,0,1,0,0.7,the order to revoke the permits awarded to Rio Tinto was ?¡ãnot in line with the constitution and the law?¡À.,74
Legal & Regulatory Compliance,1,negative:1,0,1,0,0.85,does not own land it is about to give to,13
Legal/Compliance,1,negative:1,0,1,0,0.85,class actions,89
Legal/Regulatory,1,negative:1,0,1,0,0.9,Serbia revokes Rio Tinto?¡¥s lithium mine licences,52
Limited Offer,1,neutral:1,0,0,1,0.95,LIMITED Pickup,262
Liverpool Brand Perception,1,positive:1,1,0,0,0.8,Liverpool 5 - 0 Stoke City,285
Liverpool Execution,1,positive:1,1,0,0,0.8,Liverpool 5 - 0 Stoke City,285
Liverpool Product Quality,1,positive:1,1,0,0,0.8,Liverpool 5 - 0 Stoke City,285
Living Conditions,1,negative:1,0,1,0,0.9,Slum in Rio,338
Lobbying,1,negative:1,0,1,0,0.8,"mining companies spent $541 million on lobbying Australian governments through its peak lobby groups, which are dominated by foreign interests.",73
Local Business/Commerce,1,positive:1,1,0,0,0.75,"Indica??es em Ermesinde, Rio Tinto e Gondomar",134
Localization,1,positive:1,1,0,0,0.8,[ENG SUB],201
Location Proximity,1,neutral:1,0,0,1,0.95,"apareceu um ao lado do bairro da ponte, Rio Tinto.",183
Location Risk,1,negative:1,0,1,0,0.9,"Ipanema beach, Rio de Janiero. Lose a child",275
Location/Event,1,neutral:1,0,0,1,0.95,Ostavljena suza ispred prostorija Rio Tinto - Projekat Jadar u Loznici,100
Logistics/Operations,1,neutral:1,0,0,1,0.9,No Dorms For U.S. Basketball Teams; They'll Stay On A Cruise Ship In Rio,350
M&A/Investment,1,positive:1,1,0,0,0.95,Mining giant Rio Tinto to acquire Arcadium Lithium in $6.7 billion deal!,172
Maintenance Quality,1,negative:1,0,1,0,0.95,only a few days after they finished reconditioning this stretch of rail,48
Management,1,negative:1,0,1,0,0.7,poor managemen,63
Management & Supervision,1,negative:1,0,1,0,0.95,alleged sexual harassment,23
Management/Execution,1,negative:1,0,1,0,0.95,Officials forced to cut their way into Olympic stadium after losing keys to gate,341
Market Conditions,1,negative:1,0,1,0,0.8,Plunging iron ore price,79
Market Dynamics,1,neutral:1,0,0,1,0.9,cena litijuma drasti?no pala,145
Market Expansion,1,positive:1,1,0,0,0.8,Rio Tinto,142
Market Position,1,positive:1,1,0,0,0.85,Solides Bergbauunternehmen,109
Market Structure & Regulation,1,negative:1,0,1,0,0.6,Are you buying real shares if you buy them on the German stock exchanges rather than the country they are listed in?,96
Market Value,1,negative:1,0,1,0,0.8,wipes US$100 billion off leading miners?¡¥ market value,79
Marketing/Communication,1,positive:1,1,0,0,0.8,Svaka ?ast Reddit Brigado,165
Match Strategy,1,neutral:1,0,0,1,0.85,|[NAVI](#navi-logo)|**MAP**|[FURIA](#furia-logo)|,264
Material Availability,1,positive:1,1,0,0,0.95,the only vendor available capable of fulfilling the government's required product needs at the capacity required for the contract,176
Media Coverage,1,neutral:1,0,0,1,0.9,according to Ernesto Ocampo of Superluchas.com,289
Media/Communications,1,negative:1,0,1,0,0.5,Komentari isklju?eni,67
Ministerial Appointment,1,positive:1,1,0,0,0.7,Nova ministarka za Rio Tinto,34
NAVI Performance,1,negative:1,0,1,0,0.85,Natus Vincere have placed 5th-8th and are eliminated from the Major.,264
Operational Excellence,1,negative:1,0,1,0,0.9,Rio Tinto launches investigation into missing radioactive capsule,124
Operational Focus,1,neutral:1,0,0,1,0.8,announces plans,61
Operational Reliability,1,negative:1,0,1,0,0.95,partially derailed,48
Operational Requirements,1,neutral:1,0,0,1,0.3,Solomun?¡¥s 2024/2025 equipment rider,281
Operational Risk,1,negative:1,0,1,0,0.95,Mistakenly Blowing Up,185
Operations Efficiency,1,positive:1,1,0,0,0.9,Driverless trucks move iron ore at automated Rio Tinto mines,16
Operations Management,1,negative:1,0,1,0,0.9,now closed,317
Operations/Execution,1,negative:1,0,1,0,1.0,Train hits fuel truck,355
Operations/Logistics,1,negative:1,0,1,0,0.95,Officials forced to cut their way into Olympic stadium after losing keys to gate,341
Organizational Change,1,negative:1,0,1,0,0.85,likely to go,184
Organizational Ethics,1,negative:1,0,1,0,0.9,"Soon after he set foot in Rio, part of the team was in a terme in Copacabana, in the early hours of last Thursday, 4.",284
Participation Interest,1,positive:1,1,0,0,0.8,Algu¡§|m alinha?,139
Partnership/Alliance,1,positive:1,1,0,0,0.9,Rio Tinto-Backed,40
Partnerships,1,positive:1,1,0,0,0.9,proximity to major producers such as Rio Tinto and Osisko Development,166
Partnerships/Alliances,1,positive:1,1,0,0,0.8,supply agreement with Hitachi Rail STS to provide Rio Tinto with detection systems for testing,103
Partnerships/Relationships,1,negative:1,0,1,0,0.95,ends partnership,136
Perception & Reputation,1,negative:1,0,1,0,0.6,we will forget about the massive polution and environmental destruction and the destruction of ancient aboriginal sites.,32
Performance Quality,1,negative:1,0,1,0,0.8,Taylor seemingly struggling to catch her breath,236
Personal Experience/Background,1,neutral:1,0,0,1,0.75,Eu vivia no Porto em apartamento e h¡§¡é uns meses mudei-me para Rio Tinto para moradia mas n?o conhe?o grande coisa na Zona,134
Personnel Changes,1,neutral:1,0,0,1,0.9,Rio Ferdinand announces he will leave TNT Sports,223
Physical Infrastructure,1,negative:1,0,1,0,0.4,half off,56
Platform Engagement,1,neutral:1,0,0,1,0.9,"on his platform, Truth Social.",358
Player Conduct,1,negative:1,0,1,0,0.9,"Jimmy Butler, DeRozan, Cousins and DeAndre Jordan spent 5 hours in Rio's finest brothel.",284
Player Performance,1,positive:1,1,0,0,0.85,Rio Ngumoha 2',248
Player Statistics,1,neutral:1,0,0,1,0.85,|**Team**|**K**|**A**|**D**|**ADR**|**Rating**|,264
Podcast Content,1,neutral:1,0,0,1,0.85,interrupts Rio &amp; Carricks podcast,207
Policy/Compliance,1,neutral:1,0,0,1,0.7,Rio Tinto Introduces Policy Banning the Use of Medicinal Cannabis,33
Political Context,1,negative:1,0,1,0,0.5,na Rio Tinto,97
Power Dynamics,1,negative:1,0,1,0,0.9,What If Sensei Suddenly Called a Student His Wife?,295
Product Customization,1,positive:1,1,0,0,0.15,Rio tailored a power suit,199
Product Details,1,neutral:1,0,0,1,0.95,3?? Rio (CV: Lynn) [Blue - Special/Attacker/Back],262
Product Feature,1,neutral:1,0,0,1,0.8,Tsukatsuki Rio L2D (Live2D) / Memorial Lobby,201
Product Features,1,positive:1,1,0,0,0.85,"the new UX far superior to offerings from GOOG, MSFT, and CRM. Apollo is absolutely incredible, and it?¡¥s going where no clouds have gone before?- from Humvees to nuclear submarines.",116
Product Functionality,1,positive:1,1,0,0,0.15,the suit isn't just there for protecting Sensei,199
Product Offering,1,neutral:1,0,0,1,0.3,UFC Rio on October 11,312
Product Strategy,1,neutral:1,0,0,1,0.5,calls out Max Holloway for a BMF title fight,286
Product/Service/Concept,1,neutral:1,0,0,1,0.3,PsBattle: The Rio Tinto River,14
Professionalism,1,negative:1,0,1,0,0.7,And you allowed the person to go through the process! So unprofessional!,113
Project Execution,1,positive:1,1,0,0,0.95,scooping literal truckloads of plastic,246
Project Impact,1,neutral:1,0,0,1,0.8,nije i ne mo?e biti poplavljeno,106
Project Outcome,1,negative:1,0,1,0,0.9,olympic park is mostly abandoned,280
Project Quality,1,positive:1,1,0,0,0.9,"project's access to year-round work, low dilution",166
Project Status,1,negative:1,0,1,0,0.9,revokes Rio Tinto?¡¥s lithium mine licences,52
Project Success,1,positive:1,1,0,0,0.85,140T of trash (about 37 truckloads) intercepted and extracted,273
Project Viability,1,negative:1,0,1,0,0.7,What's the Deal with Rio Tinto and the Oyut Tolgoi Mine in Southern Mongolia?,63
Project/Investment,1,positive:1,1,0,0,0.8,"Rio Tinto potvrdio da je prijavio projekat ""Jadar""",118
Protest Movement,1,neutral:1,0,0,1,0.7,u vezi sa Rio Tinto protestima,39
Public Access,1,negative:1,0,1,0,0.9,off limits to tourism,280
Public Communication,1,neutral:1,0,0,1,0.9,in her Instagram stories,228
Public Image,1,negative:1,0,1,0,0.85,does not own land it is about to give to,13
Public Perception,1,negative:1,0,1,0,0.5,Komentari isklju?eni. Ajmo laganica dislajkica,67
Public Sentiment (City Politics),1,negative:1,0,1,0,0.85,queimam boneco de Trump em ato no Rio,364
Public Transport Quality,1,negative:1,0,1,0,0.9,transporte p¡§2blico do rio ser t?o estressante,271
Reconstruction/Rebuilding,1,positive:1,1,0,0,0.7,Replica of destroyed Juukan Gorge being built,115
Recruitment Activity,1,positive:1,1,0,0,0.9,Rio Tinto is [hiring] a GPO Process Lead (2-Years Contract) at Rio Tinto!,156
Recruitment Event,1,neutral:1,0,0,1,0.95,(LIMITED Pickup Recruitment),262
Recruitment Process Timeline,1,negative:1,0,1,0,0.85,she started with ?¡ãin the coming weeks?¡À,4
Remediation/Restoration,1,positive:1,1,0,0,0.8,Replica of destroyed Juukan Gorge being built,123
Reputation & Public Trust,1,negative:1,0,1,0,0.8,destruction of ancient rock shelters,18
Reputation/Brand,1,negative:1,0,1,0,0.7,New Zealand Athlete in Rio kidnapped,326
Reputation/Public Image,1,negative:1,0,1,0,0.95,destroy Native Australian Aboriginal historical site,11
Reputation/Public Perception,1,negative:1,0,1,0,0.9,"destruction of 46,000-year-old sacred Indigenous site",80
Request/Recommendation,1,positive:1,1,0,0,0.75,Podem-me indicar,134
Resilience/Overcoming Challenges,1,positive:1,1,0,0,0.95,get through these tough times,81
Resource Access,1,positive:1,1,0,0,0.7,access to year-round work,174
Resource Accessibility,1,positive:1,1,0,0,0.8,the project's access to year-round work,152
Resource Allocation,1,negative:1,0,1,0,0.7,wasting resources.,113
Resource Availability/Discovery,1,positive:1,1,0,0,0.8,Australia has found 6 Trillion dollars worth of Iron Ore in WA.,6
Resource Extraction,1,positive:1,1,0,0,0.85,to expand iron ore mine,12
Resource Management,1,negative:1,0,1,0,0.85,does not own land it is about to give to,13
Resource Nationalism,1,negative:1,0,1,0,0.85,restreints par la Chine,77
Risk Assessment,1,negative:1,0,1,0,0.95,It this a bat shit crazy play?,1
Safety,1,negative:1,0,1,0,0.95,partially derailed,48
Safety & Security,1,neutral:1,0,0,1,0.95,se acham que h¡§¡é problema tamb¡§|m com a proximidade ao bairro do Cerco.,183
Scalability Concerns,1,negative:1,0,1,0,0.85,"One of the favorite arguments of the Palantir bears is that Palantir is an unscalable, overvalued services company that should have the same P/E as Accenture, Booz, BAE, etc.",116
Science-based Decisions,1,positive:1,1,0,0,0.9,"""We respect science""",316
Scope Clarification,1,neutral:1,0,0,1,0.95,Would prefer an answer with estimated base pay + site allowance and possible bonuses (throw in super if you can),127
Scope of Impact,1,neutral:1,0,0,1,0.85,"Operational, corporate, both?",184
Security Incident,1,negative:1,0,1,0,0.6,Um Policial Tirando um cara do telhado de um Mercado,244
Security Risk,1,negative:1,0,1,0,0.95,caught in roadside gunfight on the way to Olympic Village in Rio,321
Sentiment,1,positive:1,1,0,0,0.6,?elim svim Srbima zdravlje i sre?u. Ostanite sna?ni,92
Service Quality,1,negative:1,0,1,0,0.9,Post intersolid¡§¡ério dos desgra?ados que passaram mais de duas horas em rio tinto fechados num comboio avariado,146
Sexual Harassment,1,negative:1,0,1,0,0.85,alleged sexual harassment,31
Size/Scale,1,neutral:1,0,0,1,0.9,on a 13000 square meter land,65
Social Connection,1,positive:1,1,0,0,0.8,Preciso de malta para jogar futsal,139
Social Engagement,1,positive:1,1,0,0,0.85,organizuje koktel sutra,94
Social Experience/Atmosphere,1,positive:1,1,0,0,0.85,Porem do que explorei da zona ate agora parece me pacifica e os vizinhos ate agora foram 5*,140
Social Inequality,1,negative:1,0,1,0,0.9,"O Rio ¡§| muito bom pra quem vive igual esses dois a¡§a, na bolha do condom¡§anio a ¡§¡érea vip e a beautiful people global.",381
Social Justice Advocacy,1,positive:1,1,0,0,0.7,poziva na solidarnost i osu?uje sve napade,39
Social/Political Advocacy,1,positive:1,1,0,0,0.7,support renters.,144
Sovereignty,1,negative:1,0,1,0,0.85,restreints par la Chine,77
Sponsorship/Partnership,1,negative:1,0,1,0,0.8,"Rio Tinto, BHP ties",163
Sports,1,positive:1,1,0,0,0.8,Match Thread: Real Salt Lake v MNUFC @ Rio Tinto Stadium,98
Sportsmanship,1,negative:1,0,1,0,0.9,Navi refuse to shake hands with VP,348
Squad Management,1,neutral:1,0,0,1,0.9,Rio Ngumoha has signed his first professional contract with the Reds,235
Stakeholder Communication,1,neutral:1,0,0,1,0.8,za strate?ki projekat EU - Ekonomija,118
Stock Performance,1,negative:1,0,1,0,0.5,immer so ab Sept bergauf geht f¡§1r 6 Monate dann bergab?,122
Stoke City Brand Perception,1,negative:1,0,1,0,0.8,Liverpool 5 - 0 Stoke City,285
Stoke City Execution,1,negative:1,0,1,0,0.8,Liverpool 5 - 0 Stoke City,285
Stoke City Product Quality,1,negative:1,0,1,0,0.8,Liverpool 5 - 0 Stoke City,285
Strategic Change,1,negative:1,0,1,0,0.7,lopettaa malminetsinn?t,50
Strategic Communication,1,neutral:1,0,0,1,0.9,"President-elect referenced his majority vote in the Rio Grande Valley on his platform, Truth Social.",358
Strategic Decision,1,negative:1,0,1,0,0.8,plans to close,61
Strategic Focus,1,positive:1,1,0,0,0.8,proyecto de litio,142
Strategic Importance,1,positive:1,1,0,0,0.95,critical to America's future,176
Strategic Materials,1,positive:1,1,0,0,0.9,scandium oxide ... from a branch of the mining company Rio Tinto,170
Strategic Partnership,1,positive:1,1,0,0,0.95,amazing news For PLTR today,85
Strategic Partnerships,1,positive:1,1,0,0,0.6,na listi projekata strate?kih sirovina za EU,41
Strategic Resource Acquisition,1,positive:1,1,0,0,0.9,Rio Tinto ?eli da kopa litijum,145
Strategic Resources,1,negative:1,0,1,0,0.85,restreints par la Chine,77
Structural Integrity,1,negative:1,0,1,0,0.9,in Danger of Falling into the Rio Grande,309
Supply Chain Dependence,1,negative:1,0,1,0,0.85,restreints par la Chine,77
Supply Chain Security,1,negative:1,0,1,0,0.85,restreints par la Chine,77
Support,1,positive:1,1,0,0,0.7,Had the call about a month ago congratulating me on being selected for the role.,7
Support/Promotion,1,negative:1,0,1,0,0.5,podr?avaju Rio Tinto,107
Sustainability Commitment,1,positive:1,1,0,0,0.9,prebacivanje na struju,145
Talent Management,1,negative:1,0,1,0,0.9,Madueke Transfer,296
Targeting,1,negative:1,0,1,0,0.8,Activists set sights on Woodside and Rio Tinto director Ben Wyatt?¡¥s home,75
Tax Policy,1,positive:1,1,0,0,0.9,donner un cong¡§| de taxes et d?¡¥imp?ts,93
Team Management,1,neutral:1,0,0,1,0.9,has been added as a first team player,386
Team Performance (FURIA),1,negative:1,0,1,0,0.95,FURIA Esports have been eliminated in 3rd/4th place.,385
Team Success,1,positive:1,1,0,0,0.85,With Liverpool closing in on their 20th title,269
Timeliness,1,negative:1,0,1,0,0.7,I was advised that it can be a slow process,7
Timing of Legal Action,1,negative:1,0,1,0,0.9,hired lawyers 3 days before blasting,35
Trade,1,negative:1,0,1,0,0.7,amid tariffs,58
Training & Development,1,positive:1,1,0,0,0.85,"Nous investissons en vous, en couvrant les co?ts de la formation",150
Transparency & Inclusion,1,negative:1,0,1,0,0.8,"klju?ni stavovi aktivista, lokalnih zajednica i nezavisnih nau?nika namerno su izostavljeni",138
Transparency/Disclosure,1,negative:1,0,1,0,0.5,ko je bio za da se truju ljudi i zemlja,107
Trust & Respect,1,negative:1,0,1,0,0.8,threatened to call the police on my 7 yr old,135
Trust & Transparency,1,negative:1,0,1,0,0.85,does not own land it is about to give to,13
Trust in Process,1,positive:1,1,0,0,0.85,Habt ihr Vertrauen in das Gesetz der Serie?,2
Truth/Reality Gap,1,negative:1,0,1,0,0.9,tudo o que eles desmentem n?o ¡§| a realidade.,381
User Content Creation,1,positive:1,1,0,0,0.65,"Assortments of FuraUnsu (Nishino Flower, Seiun Sky) (by: @RIO_067)",220
Valuation,1,positive:1,1,0,0,0.85,Niedrigeres KGV,109
Value for Money,1,negative:1,0,1,0,0.9,no creo que valiera la pena.,392
Victim Support,1,negative:1,0,1,0,0.9,posts Instagram stories mocking her husband's victim,206
Waste Reduction,1,positive:1,1,0,0,1.0,use leftover Olympic food,361
Wildlife (City),1,positive:1,1,0,0,0.95,Pink river dolphin,388
Work Environment Safety,1,negative:1,0,1,0,0.95,alleged sexual harassment,23
Work Processes,1,negative:1,0,1,0,0.8,prestarts the absolute worst,126
Work-Life Balance,1,negative:1,0,1,0,0.8,slash sick leave from 45 to 12 days,27
Workforce Information,1,neutral:1,0,0,1,0.5,what the band L salary is at Rio tinto,10
Workforce Perception,1,neutral:1,0,0,1,0.7,These companies are whining about skills shortage because Gen Z/younger workers are more environmentally conscious.,49
Workplace Misconduct,1,negative:1,0,1,0,0.9,Fired Over Alleged Sexual Assault,195
Workplace Safety,1,negative:1,0,1,0,0.85,alleged sexual harassment,89
