sub_theme,count,attitudes_raw,att_pos,att_neg,att_neu,avg_conf,example,ids
Non-Company Context,68,"neutral:60, positive:7, negative:1",7,1,60,0.787,"em Rio Tinto, Gondomar","193, 197, 198, 202, 204, 211, 212, 214, 216, 218, 219, 221, 224, 225, 226, 227, 229, 233, 234, 237, 238, 239, 240, 249, 250, 251, 254, 256, 258, 259, 260, 261, 267, 268, 272, 274, 276, 277, 283, 290, 293, 297, 298, 304, 308, 313, 319, 322, 323, 328, 331, 332, 333, 342, 343, 345, 347, 349, 351, 352, 354, 362, 365, 366, 367, 373, 379, 380"
Environmental Impact,35,"negative:26, positive:6, neutral:3",6,26,3,0.798,announce early closure of Gladstone power station,"3, 20, 21, 22, 29, 42, 45, 49, 54, 59, 68, 69, 70, 74, 76, 83, 86, 87, 108, 115, 119, 120, 151, 164, 175, 177, 178, 179, 194, 273, 279, 310, 327, 336, 346"
Community Relations,31,"negative:27, positive:4",4,27,0,0.787,destroyed an indigenous Australian sacred sight,"5, 11, 28, 35, 36, 42, 47, 54, 55, 59, 64, 69, 80, 83, 99, 120, 129, 149, 151, 164, 179, 194, 217, 279, 287, 324, 340, 344, 360, 361, 363"
Ethics/Compliance,25,"negative:24, neutral:1",0,24,1,0.798,legally destroy,"11, 22, 26, 28, 42, 44, 46, 53, 54, 80, 89, 99, 129, 149, 163, 195, 206, 230, 295, 302, 329, 334, 344, 363, 389"
Brand Perception,22,"negative:15, positive:7",7,15,0,0.766,Rio Tinto mar? iz Srbije!,"111, 195, 206, 208, 209, 213, 252, 282, 291, 296, 302, 317, 324, 334, 337, 339, 340, 363, 371, 378, 389, 391"
Safety Culture,16,negative:16,0,16,0,0.862,prestarts the absolute worst,"126, 195, 206, 230, 236, 243, 279, 282, 300, 301, 305, 326, 336, 344, 355, 359"
Communication,13,"negative:10, neutral:2, positive:1",1,10,2,0.815,I?¡¥ve just been told I?¡¥ve got past the interview stage,"4, 7, 9, 47, 95, 112, 114, 117, 146, 179, 203, 207, 320"
Product Quality,11,"negative:6, positive:3, neutral:2",3,6,2,0.736,Rio Tinto u Bosni,"83, 192, 210, 257, 292, 309, 317, 356, 369, 371, 392"
Transparency,10,"negative:9, positive:1",1,9,0,0.815,not heard anything since,"7, 28, 53, 73, 110, 113, 131, 179, 320, 378"
Customer Experience,9,"negative:5, positive:4",4,5,0,0.822,performs for over 2 million people,"209, 243, 265, 271, 282, 353, 369, 371, 392"
Public Safety (City),9,"negative:7, neutral:1, positive:1",1,7,1,0.85,"Well, I got robbed in Rio (lol)","200, 232, 253, 325, 330, 357, 375, 382, 390"
Governance,7,"negative:4, neutral:3",0,4,3,0.571,"forcing the government to stop prioritizing oil, gas, and coal companies like Adani and Rio Tinto","69, 80, 88, 112, 314, 329, 338"
Cultural Heritage,6,negative:6,0,6,0,0.825,blasts 46000 year old Aboriginal site,"12, 22, 115, 123, 151, 164"
Event Management,6,"negative:5, neutral:1",0,5,1,0.825,Rio 2016: Swimmers need to ingest only three teaspoons of water to be almost certain of contracting a virus,"278, 282, 286, 291, 315, 384"
Execution,6,"positive:4, negative:1, neutral:1",4,1,1,0.775,performs for over 2 million people,"209, 273, 309, 314, 337, 371"
Leadership/Management,6,"negative:4, neutral:2",0,4,2,0.717,strips its CEO US$3.5 million in performance bonuses,"26, 46, 78, 80, 99, 294"
Market Positioning,6,"neutral:3, positive:3",3,0,3,0.717,the next Rio Tinto,"57, 159, 194, 209, 213, 337"
Risk Management,6,"negative:5, neutral:1",0,5,1,0.892,preparing for potential injunction,"35, 124, 147, 230, 306, 355"
Community Engagement,5,"positive:4, negative:1",4,1,0,0.86,tribute to Kyle Beckerman,"121, 138, 141, 165, 183"
Corporate Responsibility,5,"negative:4, positive:1",1,4,0,0.83,blasts 46000 year old Aboriginal site to expand,"12, 42, 62, 141, 178"
Geographic Expansion,5,positive:5,5,0,0,0.82,in Canada Project,"40, 152, 162, 171, 174"
Location,5,neutral:5,0,0,5,0.74,"Aboard a Royal Flying Doctor plane, leaving Rio Tinto's West Angelas iron ore mine, the Pilbara Western Australia.","105, 155, 156, 180, 190"
Safety/Security,5,"negative:4, neutral:1",0,4,1,0.84,se essa regi?o ¡§| segura ou se ¡§| melhor evitar,"133, 266, 338, 353, 381"
Wellbeing,5,"negative:4, positive:1",1,4,0,0.77,Taylor seemingly struggling to catch her breath,"236, 263, 321, 336, 360"
Accountability,4,"negative:3, positive:1",1,3,0,0.762,CEO resigns,"80, 107, 112, 334"
Compensation & Benefits,4,"neutral:2, negative:1, positive:1",1,1,2,0.775,what the band L salary is,"10, 27, 150, 188"
Hiring,4,positive:4,4,0,0,0.775,a Maintenance Scheduler at Rio Tinto! in Rio Tinto,"154, 157, 158, 187"
Innovation,4,positive:4,4,0,0,0.85,"used by the ancient Romans at the Rio Tinto mines in Spain. To remove water from deep underground mines, the Romans used no less than 16 wheels working in pairs and stacked above one another.","24, 108, 168, 178"
Investment,4,"positive:3, negative:1",3,1,0,0.862,to Invest $1.1 Billion,"40, 102, 142, 192"
Legal Action,4,"negative:3, neutral:1",0,3,1,0.9,class actions against Rio Tinto and BHP,"30, 31, 38, 302"
Operational Efficiency,4,"positive:2, negative:2",2,2,0,0.888,access to year-round work,"162, 171, 243, 271"
Public Health,4,"negative:3, positive:1",1,3,0,0.9,Rio Olympics could spark 'full blown global health disaster',"306, 315, 316, 359"
Recruitment Process,4,"negative:2, positive:2",2,2,0,0.8,I applied for a job that closed over a week ago and application still under review?,"9, 113, 153, 186"
Reputation,4,negative:4,0,4,0,0.887,destroyed an indigenous Australian sacred sight,"5, 42, 99, 151"
Strategy,4,"neutral:2, negative:1, positive:1",1,1,2,0.7,krenulo Rio Tinto mar? iz Srbije,"47, 168, 194, 314"
Brand Recognition,3,"neutral:2, positive:1",1,0,2,0.7,"Which one is more well known, the Edwards Air Force Base or the Rio Tinto Borax mine?","137, 165, 201"
Capital Efficiency,3,positive:3,3,0,0,0.8,low dilution,"152, 162, 174"
Career Growth,3,positive:3,3,0,0,0.867,Grad Mech Engg interview with Rio Tinto - help!,"167, 235, 386"
Crisis Response,3,"negative:1, neutral:1, positive:1",1,1,1,0.917,Rio Tinto launches investigation into missing radioactive capsule,"124, 228, 305"
Information Seeking,3,"neutral:2, positive:1",1,0,2,0.85,Weirdly can't find the info online.,"82, 167, 184"
Job Availability,3,positive:3,3,0,0,0.833,a Maintenance Scheduler at Rio Tinto! in Rio Tinto,"153, 156, 182"
Migration (City),3,"neutral:2, negative:1",0,1,2,0.867,migrants crossing the Rio Grande,"242, 245, 383"
Natural Disaster (City),3,negative:3,0,3,0,0.9,worst flooding crisis since 1941,"303, 372, 377"
Reputation & Public Perception,3,negative:3,0,3,0,0.883,"blasting of 46,000-year-old Aboriginal sites","37, 141, 185"
Reputation/Perception,3,negative:3,0,3,0,0.667,Was halten wir von der Rohstoffbude?,"8, 64, 97"
Respect,3,"negative:2, positive:1",1,2,0,0.8,A cascarla al rio,"203, 295, 387"
Stakeholder Relations,3,negative:3,0,3,0,0.467,nikad ne?e zaustaviti projekat Jadar,"44, 141, 314"
Sustainability,3,"positive:2, negative:1",2,1,0,0.917,ne treba da kopa,"42, 108, 178"
Wildlife Rescue (City),3,positive:3,3,0,0,0.767,from the Rio Negro,"205, 241, 255"
Athlete Safety,2,negative:2,0,2,0,0.925,Lucas Almeida?¡¥s right hand appears to be broken. Heavily swollen at the ceremonial weigh ins.,"263, 278"
Attendee Wellbeing,2,"negative:1, positive:1",1,1,0,0.8,fan dies after falling ill,"301, 305"
Collaboration,2,positive:2,2,0,0,0.825,"Exxon, Chevron, Rio Tinto","168, 178"
Collaboration/Teamwork,2,positive:2,2,0,0,0.775,If we all pitch in,"81, 387"
Community/Neighborhood,2,positive:2,2,0,0,0.75,Algum conselho? Algu¡§|m que j¡§¡é fez essa mudan?a pode me dizer como foi essa mudan?a e adapta??o?,"133, 134"
Competitor Comparison,2,neutral:2,0,0,2,0.6,the next Rio Tinto ($RIO),"57, 159"
Compliance,2,negative:2,0,2,0,0.85,destroy 124 more Australian Aboriginal sites,"59, 120"
Corporate Social Responsibility,2,negative:2,0,2,0,0.8,"blasting of 46,000-year-old Aboriginal sites","37, 49"
Date/Time Reference,2,neutral:2,0,0,2,0.7,"October 11, 2025","155, 156"
Economic Impact,2,"neutral:1, negative:1",0,1,1,0.675,Kitimat's Rio Tinto Alcan smelter to feel,"66, 222"
Emotional Impact,2,"positive:1, negative:1",1,1,0,0.925,suza je od sre?e,"100, 275"
Employee Relations,2,negative:2,0,2,0,0.825,slash sick leave from 45 to 12 days,"27, 89"
Employee Treatment,2,negative:2,0,2,0,0.95,"Being urinated on, defecated in front of, sexually groped, harassed","23, 38"
Energy Efficiency,2,positive:2,2,0,0,0.95,solar power and battery purchase,"108, 128"
Ethical Conduct,2,negative:2,0,2,0,0.925,destroyed an indigenous Australian sacred sight,"5, 231"
Ethics,2,negative:2,0,2,0,0.6,wake-up call for ethical investors,"148, 340"
Ethics & Compliance,2,negative:2,0,2,0,0.75,"blasting of 46,000-year-old Aboriginal sites","37, 130"
Financial Stability,2,negative:2,0,2,0,0.85,potential debt relief for the state,"63, 318"
Government Relations,2,"negative:1, neutral:1",0,1,1,0.825,"Serbia's government is doing everything to support Rio Tinto, even changing its constitution","15, 58"
Hiring/Recruitment,2,"positive:1, neutral:1",1,0,1,0.95,Rio Tinto is [hiring] a Electrical Engineer (High Voltage) at Rio Tinto!,"189, 191"
Inclusion,2,"negative:1, positive:1",1,1,0,0.65,thinks homosexuality is ??evil?¡¥,"340, 387"
Indigenous Relations,2,negative:2,0,2,0,0.85,blasts 46000 year old Aboriginal site,"12, 13"
Information Availability,2,"neutral:1, positive:1",1,0,1,0.9,Wasn't sure if this is across the board for all of them.,"82, 95"
International Relations,2,negative:2,0,2,0,0.825,restreints par la Chine,"77, 138"
Job Opportunity,2,"positive:1, neutral:1",1,0,1,0.95,Rio Tinto is [hiring] a Electrical Engineer (High Voltage),"189, 191"
Job Title/Role,2,"positive:1, neutral:1",1,0,1,0.675,GardaWorld is hiring a Pompier - Rio Tinto ¡§¡è Alma,"150, 155"
Leadership,2,"positive:1, negative:1",1,1,0,0.8,says Rio mayor,"316, 340"
Legal & Compliance,2,negative:2,0,2,0,0.95,class actions being brought,"23, 38"
Location/Geography,2,neutral:2,0,0,2,0.85,"Ermesinde, Rio Tinto e Gondomar","134, 189"
Professional Conduct,2,negative:2,0,2,0,0.95,puts other fighters on blast,"247, 295"
Project Development,2,"negative:1, neutral:1",0,1,1,0.575,Kome do sad nije jasno da nas ova vlast vodi u propast i da oni nikad ne?e zaustaviti projekat Jadar,"44, 335"
Psychological Safety,2,negative:2,0,2,0,0.9,A cascarla al rio,"203, 295"
Public Relations,2,neutral:2,0,0,2,0.8,a few articles contest,"63, 296"
Recognition,2,positive:2,2,0,0,0.925,inducted into the Hall of Fame,"374, 386"
Recruitment,2,"positive:1, neutral:1",1,0,1,0.9,Rio Tinto is [hiring] a Principal Advisor Tactical Control,"180, 190"
Safety & Compliance,2,negative:2,0,2,0,0.85,losing device,"70, 124"
Security,2,negative:2,0,2,0,0.875,threatened to call the police,"135, 341"
Social Impact,2,positive:2,2,0,0,0.925,extracted from the Rio Las Vacas in Guatemala,"273, 361"
Stakeholder Engagement,2,negative:2,0,2,0,0.85,does not own land it is about to give to,"13, 42"
Strategic Positioning,2,positive:2,2,0,0,0.85,proximity to major producers such as Rio Tinto and Osisko Development,"162, 171"
Strategic Proximity,2,positive:2,2,0,0,0.75,proximity to major producers such as Rio Tinto and Osisko Development,"152, 174"
Strategic Rationale,2,positive:2,2,0,0,0.85,"Triumph Gold's rationale for expanding into the United States, highlighting the project's access to year-round work, low dilution, and proximity to major producers such as Rio Tinto and Osisko Develop","143, 166"
Supply Chain,2,"positive:1, neutral:1",1,0,1,0.775,Apple buys first-ever carbon-free aluminum,"178, 181"
Talent Acquisition,2,"positive:1, neutral:1",1,0,1,0.9,Rio Ngumoha has signed his first professional contract with the Reds,"235, 289"
Taxation,2,negative:2,0,2,0,0.8,pay so much little tax compared with similar projects in Qatar (on average 20x higher taxable income from these projects) as well as in Norway (the government there has significant ownership in each m,"73, 131"
Team Performance,2,negative:2,0,2,0,0.85,0 Athletic Club,"248, 269"
Timeline/History,2,neutral:2,0,0,2,0.75,five years after,"115, 123"
Trade Policy,2,negative:2,0,2,0,0.675,Trump's sudden aluminum tariff,"66, 222"
Water Quality,2,negative:2,0,2,0,0.875,many toxic looking different red shades,"21, 300"
Work Environment,2,"negative:1, neutral:1",0,1,1,0.85,alleged sexual harassment,"30, 90"
Workplace Conduct,2,negative:2,0,2,0,0.925,alleged sexual harassment,"38, 206"
Workplace Culture,2,negative:2,0,2,0,0.925,alleged sexual harassment,"23, 203"
Accommodation,1,neutral:1,0,0,1,0.9,Stay On A Cruise Ship In Rio,350
Achievement,1,positive:1,1,0,0,0.95,inducted into the Hall of Fame,374
Acquisition Impact,1,positive:1,1,0,0,0.85,Durch die ¡§1bernahme von Arcadium Lithium,109
Activism,1,negative:1,0,1,0,0.8,Activists set sights on Woodside and Rio Tinto director Ben Wyatt?¡¥s home,75
Activity Organization,1,positive:1,1,0,0,0.8,Jogo porreiro e bem dividido,139
Adaptability,1,positive:1,1,0,0,0.4,Rio could be this flexible,196
Advertisement Quality,1,positive:1,1,0,0,0.95,Tranquila y apta para los tiempos modernos la publicidad,391
Asset Management,1,negative:1,0,1,0,0.9,olympic park is mostly abandoned,280
Athlete Wellbeing,1,negative:1,0,1,0,0.95,contracting a virus,278
Automation,1,negative:1,0,1,0,0.95,Rio Tinto train drivers to be replaced by robots,91
Automation & Technology,1,positive:1,1,0,0,0.9,Driverless trucks move iron ore at automated Rio Tinto mines,16
Availability Period,1,neutral:1,0,0,1,0.95,"[January 27 - February 3, 2025]",262
Belonging,1,positive:1,1,0,0,0.85,Welcome to Rio,288
Benefits/Perks,1,positive:1,1,0,0,0.9,Do you get qantas points doing fifo for rio tinto?,82
Bias/Fairness,1,negative:1,0,1,0,0.85,They struggle to mention Liverpool in anything good and always provide subdued commentary when we are winning/playing well.,269
Brand Association,1,positive:1,1,0,0,0.7,"skandiraju ""Rio Tinto mar? iz Srbije""",84
Brand Consistency,1,negative:1,0,1,0,0.9,sendo todos geridos pelo mesmo grupo acho que o solinca poderia investir mais neste local,192
Brand/Product Association,1,negative:1,0,1,0,0.7,"Vecerasnja parola navijaca Radnickog iz Kragujevca, Rio Tinto Mars Iz Srbije.",60
Branding & Publicity,1,positive:1,1,0,0,0.95,The largest offset in U.S. Sports,128
Broadcasting,1,positive:1,1,0,0,0.9,"TUDN Radio Austin (104.3-HD2, KLQB)",95
Budgeting,1,negative:1,0,1,0,1.0,"declares financial emergency, requests funding",318
Business Decision,1,neutral:1,0,0,1,0.92,Rio Tinto's Gladstone coal-fired power station to close six years early,45
Business Development,1,positive:1,1,0,0,0.8,provide Rio Tinto with detection systems for testing,103
Business Environment,1,neutral:1,0,0,1,0.85,"Vom Gesch?ftsumfeld her und dergleichen hat sich bei dem Unternehmen, aus meiner Sicht, nicht wirklich etwas ge?ndert.",2
Business Partnership,1,positive:1,1,0,0,0.8,Or maybe they?¡¥re opening more positions due to their new partnership with Hancock Prospecting?,161
Business Relations,1,positive:1,1,0,0,0.9,donner un cong¡§| de taxes et d?¡¥im,93
Career Opportunity,1,positive:1,1,0,0,1.0,Rio Tinto is [hiring] a Electrical Engineer (High Voltage),190
Casting,1,neutral:1,0,0,1,0.95,Donald Faison and Judy Reyes for live action Jefferson Davis and Rio Morales,335
Child & Family,1,negative:1,0,1,0,0.8,threatened to call the police on my 7 yr old for WANTING to come and see me,135
Child Safety,1,negative:1,0,1,0,0.9,Lose a child and you're fucked.,275
Clarification & Confirmation,1,neutral:1,0,0,1,0.6,"How can overseas companies like Rio Tinto, Droneshield, etc be listed on German stock exchanges when they are officially only listed overseas?",96
Climate Action & Sustainability,1,negative:1,0,1,0,0.7,corporate lobbying to undermine climate solutions,104
Climate Action Commitment,1,positive:1,1,0,0,0.95,Rio Tinto says pandemic no excuse to delay climate action.,17
Collaboration/Partnership,1,positive:1,1,0,0,0.7,dovedena da potpi?e sve sa Rio Tintom,34
Collaboration/Partnerships,1,positive:1,1,0,0,0.6,u planu saradnja sa poznatom kineskom kompanijom,71
Commentary Quality,1,negative:1,0,1,0,0.85,No Rio Ferdinand and Gary Neville in Liverpool games please,269
Commodity Price Volatility,1,neutral:1,0,0,1,0.9,cena litijuma drasti?no pala,145
Communication & Transparency,1,negative:1,0,1,0,0.6,Targets lower morale and devalue the people you proport to value.,32
Community & Brand,1,neutral:1,0,0,1,0.5,"Rio Tinto River, known as the Red River",25
Community Concerns,1,negative:1,0,1,0,0.85,?uvena o?na voda jedva kaplje,175
Community relations,1,positive:1,1,0,0,0.6,Podr?ka Srbiji iz Hrvatske,92
Community/Sharing Information,1,positive:1,1,0,0,0.9,I've done a fair few swings with roy hill and have got them even as a contractor.,82
Community/Support,1,positive:1,1,0,0,0.8,"I was just wondering if anyone had ever attended a rio tinto assesment centre before, and if so any advice on how to be successful?",186
Company Existence,1,negative:1,0,1,0,1.0,&amp; so is Blue Sky Studios.,376
Company Location,1,neutral:1,0,0,1,0.95,"Location: Kitimat, BC, CA",187
Company Name,1,neutral:1,0,0,1,0.95,Rio Tinto,187
Company Presence,1,neutral:1,0,0,1,0.95,"Location: Kitimat, BC, CA",191
Company Strategy,1,neutral:1,0,0,1,0.9,signed with WWE,289
Comparison/Comparison,1,neutral:1,0,0,1,0.9,Rio Tinto vs Nyambaatar,65
Compensation,1,positive:1,1,0,0,0.95,Paid like surgeons: 240k a year,91
Compensation Inquiry,1,neutral:1,0,0,1,0.95,was just curious how much Graduates (specifically geos or mining engineers) get paid at a major iron operation like BHP/Rio Tinto/Fortescue?,127
Competition,1,positive:1,1,0,0,0.8,Match Thread: Real Salt Lake v MNUFC @ Rio Tinto Stadium,98
Competitive Performance,1,positive:1,1,0,0,0.9,Bad News Eagles are now 1-2 in the Legends Stage.,299
Competitive Positioning,1,neutral:1,0,0,1,0.7,"Jadarit je i otkriven tako sto se trazio bor, ali trenutno potraznja za borom i bornim jedinjenjima kao prozivodima trenutno nema komercijalnu vrednost",147
Competitiveness,1,negative:1,0,1,0,0.85,restreints par la Chine,77
Competitor Activity,1,neutral:1,0,0,1,0.9,AAA wrestlers who have already signed with WWE,289
Compliance & Ethics,1,negative:1,0,1,0,0.9,alleged sexual harassment,30
Compliance/Governance,1,negative:1,0,1,0,0.9,equipment fault caused emissions,86
Conflict,1,negative:1,0,1,0,0.9,"Navi refuse to shake hands with VP, Aleksi seems to be adamantly saying something.",348
Content Moderation,1,neutral:1,0,0,1,0.9,orders its removal from digital platforms,302
Contract Type,1,neutral:1,0,0,1,0.9,2-Years Contract,156
Contractor Selection,1,negative:1,0,1,0,0.9,Trump?¡¥s Hand-Picked Contractor,309
Corporate Conduct,1,negative:1,0,1,0,0.7,Spin ma?inera glavnih neimara sa severa...,19
Corporate Ethics,1,negative:1,0,1,0,0.85,does not own land it is about to give to,13
Corporate Strategy,1,positive:1,1,0,0,0.9,donner un cong¡§| de taxes et d?¡¥imp?ts,93
Cost/Value,1,neutral:1,0,0,1,0.75,vou abrir m?o de diversas coisas como mercados mais pr¡§?ximos,133
Covid Vaccination Policy,1,positive:1,1,0,0,0.95,good thing I got mine back in July.,43
Creative Ideation,1,neutral:1,0,0,1,0.95,CASTING IDEA,335
Credit/Acknowledgement,1,positive:1,1,0,0,0.3,Credits to @dj_gugu on Instagram.,281
Crisis Management,1,negative:1,0,1,0,0.9,Zika crisis: Rio Olympics 'should be moved or postponed',315
Cultural Expression,1,positive:1,1,0,0,0.7,"skandiraju ""Rio Tinto mar? iz Srbije""",84
Cultural Heritage Destruction,1,negative:1,0,1,0,0.9,"blasting of 46,000-year-old Aboriginal sites",37
Cultural Respect,1,negative:1,0,1,0,0.95,destroy Native Australian Aboriginal historical site,11
Cultural Sensitivity,1,negative:1,0,1,0,0.95,destroyed an indigenous Australian sacred sight,5
Customer Engagement,1,positive:1,1,0,0,0.95,we also like other stocks,85
Customer Expectations,1,neutral:1,0,0,1,0.8,how did reality compare to your expectations?,208
Customer Satisfaction,1,negative:1,0,1,0,0.9,fiquei pasmado com a diferen?a para os outros.,192
Date,1,neutral:1,0,0,1,0.8,"September 23, 2025",180
Decision-Making Factor,1,positive:1,1,0,0,0.9,"Contemplating applying for rio, it'd be especially handy for trips home.",82
Defense Collaboration,1,positive:1,1,0,0,0.95,actively collaborating with the U.S. government to identify opportunities and leverage available support to increase domestic production and strengthen supply chains,176
Demand,1,negative:1,0,1,0,0.8,Declining demand due to China property rout,79
Diversity,1,neutral:1,0,0,1,0.95,90% Mexican and Mexican-American,215
Diversity & Inclusion,1,negative:1,0,1,0,0.6,targets inevitably lead to diversity hires and diversity hires get no respect.,32
Dividend,1,positive:1,1,0,0,0.85,hohe Dividende,109
Duty of Care,1,negative:1,0,1,0,0.9,appearing to ignore a mother and baby?¡¥s pleas for help,231
Economic Development,1,positive:1,1,0,0,0.7,give green light to,68
Economic Outlook,1,neutral:1,0,0,1,0.85,China gerade in einer Wirtschaftskrise,109
Efficiency,1,negative:1,0,1,0,0.85,"surely it doesn?¡¥t take that long to organise a medical, police and reference check.",4
Electoral Performance,1,positive:1,1,0,0,0.9,majority vote in the Rio Grande Valley,358
Emergency Response,1,positive:1,1,0,0,0.95,"Finally, we saw the flashlight beam pointing at us. ?¡ãHere!?¡À we shouted waving our arms, like castaways spotting a rescue helicopter. When they reached us, My wife looked at me as if to say, ?¡ãHoly crap",243
Employee Conduct,1,negative:1,0,1,0,0.95,Wisconsin staffer Jack Del Rio arrested for drunk driving,389
Employee Departure,1,neutral:1,0,0,1,0.95,Rio Ferdinand to quit TNT Sports immediately after Champions League final,270
Employee Policy,1,negative:1,0,1,0,0.7,Banning the Use of Medicinal Cannabis,33
Employee Safety,1,negative:1,0,1,0,0.95,reporters caught in roadside gunfight,321
Employee Wellbeing,1,negative:1,0,1,0,0.35,ICE at it again today.,217
Energy Strategy,1,positive:1,1,0,0,0.9,solar power and battery purchase,169
Energy Transition,1,positive:1,1,0,0,0.92,Rio Tinto's Gladstone coal-fired power station to close six years early,45
Energy/Utilities,1,neutral:1,0,0,1,0.9,announces early closure of Gladstone Power Station,173
Environmental Action,1,positive:1,1,0,0,0.95,The Ocean Cleanup scooping literal truckloads of plastic out of the Rio Las Vacas river,246
Environmental Concern,1,negative:1,0,1,0,0.8,promovi?u projekat Jadar i Rio Tinto,138
Environmental impact,1,negative:1,0,1,0,0.6,ugro?ena je sigurnost voda,92
Environmental Protection,1,positive:1,1,0,0,0.8,Eco-activists Launch Protest For Nationwide Lithium Mining Ban,132
Environmental Quality,1,negative:1,0,1,0,0.9,"'super bacteria' in Rio's Olympic venues, top beaches.",359
Environmental Sustainability,1,positive:1,1,0,0,0.95,install solar panels at that will offset 73% of their power needs,128
Ethics/Integrity,1,negative:1,0,1,0,0.9,Rio police exaggerated their version of Ryan Lochte events,320
Event Integrity,1,negative:1,0,1,0,0.9,Heavily swollen at the ceremonial weigh ins. He fights Michael Aswell tomorrow at UFC Rio.,263
Event Organization,1,positive:1,1,0,0,0.8,organizova?e ga grupa srpske dijaspore ?Palac gore?¡À.,138
Event Outcome,1,neutral:1,0,0,1,0.85,Liverpool [1] - 0 Athletic Club,248
Event Preparation,1,neutral:1,0,0,1,0.95,stockpile for the RIO games,370
Event Status,1,negative:1,0,1,0,1.0,his Rio fight is off,247
Executive Compensation,1,negative:1,0,1,0,0.8,stripped of $4.9m in bonuses,18
Exploration Rights,1,neutral:1,0,0,1,0.3,za istra?ivanje i eksploataciju,177
External Link,1,neutral:1,0,0,1,0.9,Apply &amp; Description ?? https://jobboardsearch.com/redirect?utm_source=reddit&amp;utm_medium=bot&amp;utm_id=jobboarsearch&amp;utm_term=www.constructionjobsaustralia.com&amp;rurl=aHR0cHM6Ly93d3cuY29u,156
External Mentions,1,neutral:1,0,0,1,0.65,Sources,
External Risk,1,negative:1,0,1,0,0.7,kidnapped by men in police uniform and forced to withdraw money from ATMs,326
Facilities Condition,1,negative:1,0,1,0,0.9,a idade de certas maquinas (as smith parecem da guerra do ultramar),192
Facilities/Infrastructure,1,negative:1,0,1,0,0.9,"Rio Olympics Athletes' Village Declared ""Uninhabitable""",307
Fan Engagement,1,positive:1,1,0,0,0.7,"skandiraju ""Rio Tinto mar? iz Srbije""",84
Fan Safety,1,negative:1,0,1,0,0.9,death of a fan,228
Fear-Mongering,1,negative:1,0,1,0,0.8,Politicians have been feeding on fear for years.,110
Financial Assistance,1,neutral:1,0,0,1,0.7,financial assistance,58
Financial Performance,1,negative:1,0,1,0,0.8,threatens profit,79
Financial Strategy,1,positive:1,1,0,0,0.8,low dilution,171
Fiscal Policy,1,positive:1,1,0,0,0.9,un cong¡§| de taxes et d?¡¥imp?ts,93
Food/Recipe Sharing,1,positive:1,1,0,0,0.3,Tava a falar com um colega que tinha feito molho e ele disse que um amigo tinha uma boa receita que lhe tinham enviado caso quisesse experimentar.,101
Foreign Ownership,1,negative:1,0,1,0,0.8,"the largest shareholder in Rio Tinto (18%) and Woodside (over 5%). All are mostly foreign-owned, with Australian investors, governments, and individuals owning less than 18% of each company, making it",73
Funding,1,negative:1,0,1,0,1.0,requests funding for Olympics,318
FURIA Performance,1,positive:1,1,0,0,0.85,FURIA Esports are through to the semi-finals and will face [????](#heroic-logo) Heroic,264
Gender Discrimination,1,negative:1,0,1,0,0.95,gender discrimination,23
Geographic Focus,1,neutral:1,0,0,1,0.8,New Zealand,61
Geographic Location,1,neutral:1,0,0,1,0.9,"Kitimat, BC, CA",153
Geopolitical Relations,1,negative:1,0,1,0,0.8,Tvrdnje o neokolonijalnom odnosu EU prema resursima Srbije,72
Geopolitical Stability,1,negative:1,0,1,0,0.85,restreints par la Chine,77
Governance & Accountability,1,negative:1,0,1,0,0.8,stripped of $4.9m in bonuses,18
Governance & Compliance,1,neutral:1,0,0,1,0.3,O po?tovanju zakona i propisa,177
Governance & Ethics,1,negative:1,0,1,0,0.7,corporate lobbying to undermine climate solutions,104
Governance & Oversight,1,negative:1,0,1,0,0.95,Stripped Of Licence,185
Governance/Accountability,1,negative:1,0,1,0,0.95,Government gives Taylor Swift concert producer 24 hours to explain,230
